{
  "envelope": {
    "id": "STK-002", "source": "cli", "project": "stock-control",
    "task_type": "qa-review", "agent": "qa-reviewer",
    "title": "Regression pass on checkout", "instructions": "Run the regression suite on checkout.",
    "repo_path": "~/dev/surtec/stock-control", "branch": "agent/STK-002-qa-reviewer",
    "sandbox": "read-only", "expected_outputs": ["summary", "tests_run"],
    "requires_human_approval": false, "metadata": {}
  },
  "lifecycle": "running", "outcome": null,
  "created_at": "2026-05-28T11:00:00Z", "started_at": "2026-05-28T11:02:00Z",
  "updated_at": "2026-05-28T11:15:00Z", "finished_at": null,
  "result": null, "logs_path": null
}
